name,category,price,stock,description,images,slug
Wireless Mouse,Electronics,19.99,150,Ergonomic wireless mouse with USB receiver,mouse.jpg,wireless-mouse
Yoga Mat,Fitness,25.50,80,Non-slip yoga mat for all exercises,yogamat.png,yoga-mat
Coffee Mug,Kitchen,7.99,200,Ceramic mug with motivational quote,mug.jpg,coffee-mug
Bluetooth Speaker,Electronics,45.00,60,Portable speaker with 10-hour battery life,speaker.jpg,bluetooth-speaker
Notebook,Stationery,2.50,500,notebook for students,notebook.png,notebook
